{
  "query_id": "p4_q006",
  "table_id": "p4_t04.xlsx",
  "query": "What is the absolute difference between civilian noninstitutional population and civilian labor force for women with 'Some college, no degree'? Answer with only the integer, without commas or units.",
  "input_mode": "parsed",
  "table_view": "TABLE: p4_t04.xlsx | SHEET: cpsaat07 | DIMENSIONS: A1:I68 | VISIBILITY: visible\nMERGED_RANGES: [\"A65:I65\", \"A68:I68\", \"A4:A6\", \"D5:F5\", \"G5:I5\", \"A66:I66\", \"A1:I1\", \"A67:I67\", \"B5:B6\", \"B4:I4\", \"C5:C6\"]\nr1: A1=\"HOUSEHOLD DATA\\nANNUAL AVERAGES\\n7. Employment status of the civilian noninstitutional population 25 years and over by educational attainment, sex, race, and Hispanic or Latino ethnicity\"\nr2: A2=\"[Numbers in thousands]\"\nr3: A3=\"\"\nr4: A4=\"Employment status,\\n sex, race, and Hispanic\\n or Latino ethnicity\"; B4=2023\nr5: B5=\"Less than a\\nhigh school\\ndiploma\"; C5=\"High school\\ngraduates,\\nno college(1)\"; D5=\"Some college or associate degree\"; G5=\"Bachelor's degree and higher\"\nr6: D6=\"Total\"; E6=\"Some college,\\nno degree\"; F6=\"Associate\\ndegree\"; G6=\"Total(2)\"; H6=\"Bachelor's\\ndegree\\nonly\"; I6=\"Advanced\\ndegree\"\nr7: A7=\"\"\nr8: A8=\"TOTAL\"\nr9: A9=\"Civilian noninstitutional population\"; B9=19480; C9=63419; D9=56926; E9=32847; F9=24079; G9=87778; H9=54106; I9=33672\nr10: A10=\"Civilian labor force\"; B10=9180; C10=35928; D10=35803; E10=19911; F10=15891; G10=64077; H10=39357; I10=24720\nr11: A11=\"Participation rate\"; B11=47.1; C11=56.7; D11=62.9; E11=60.6; F11=66; G11=73; H11=72.7; I11=73.4\nr12: A12=\"Employed\"; B12=8669; C12=34529; D12=34714; E12=19256; F12=15457; G12=62752; H12=38489; I12=24263\nr13: A13=\"Employment-population ratio\"; B13=44.5; C13=54.4; D13=61; E13=58.6; F13=64.2; G13=71.5; H13=71.1; I13=72.1\nr14: A14=\"Unemployed\"; B14=511; C14=1399; D14=1089; E14=655; F14=434; G14=1324; H14=868; I14=456\nr15: A15=\"Unemployment rate\"; B15=5.6; C15=3.9; D15=3; E15=3.3; F15=2.7; G15=2.1; H15=2.2; I15=1.8\nr16: A16=\"Men\"\nr17: A17=\"Civilian noninstitutional population\"; B17=9967; C17=32446; D17=26821; E17=16051; F17=10770; G17=41402; H17=25774; I17=15628\nr18: A18=\"Civilian labor force\"; B18=5919; C18=21412; D18=18500; E18=10783; F18=7717; G18=31821; H18=20100; I18=11721\nr19: A19=\"Participation rate\"; B19=59.4; C19=66; D19=69; E19=67.2; F19=71.7; G19=76.9; H19=78; I19=75\nr20: A20=\"Employed\"; B20=5617; C20=20559; D20=17928; E20=10431; F20=7497; G20=31153; H20=19661; I20=11493\nr21: A21=\"Employment-population ratio\"; B21=56.4; C21=63.4; D21=66.8; E21=65; F21=69.6; G21=75.2; H21=76.3; I21=73.5\nr22: A22=\"Unemployed\"; B22=302; C22=852; D22=573; E22=352; F22=220; G22=668; H22=439; I22=229\nr23: A23=\"Unemployment rate\"; B23=5.1; C23=4; D23=3.1; E23=3.3; F23=2.9; G23=2.1; H23=2.2; I23=1.9\nr24: A24=\"Women\"\nr25: A25=\"Civilian noninstitutional population\"; B25=9513; C25=30973; D25=30105; E25=16796; F25=13309; G25=46376; H25=28331; I25=18044\nr26: A26=\"Civilian labor force\"; B26=3262; C26=14516; D26=17302; E26=9128; F26=8174; G26=32256; H26=19257; I26=12998\nr27: A27=\"Participation rate\"; B27=34.3; C27=46.9; D27=57.5; E27=54.3; F27=61.4; G27=69.6; H27=68; I27=72\nr28: A28=\"Employed\"; B28=3052; C28=13970; D28=16786; E28=8826; F28=7960; G28=31599; H28=18828; I28=12771\nr29: A29=\"Employment-population ratio\"; B29=32.1; C29=45.1; D29=55.8; E29=52.5; F29=59.8; G29=68.1; H29=66.5; I29=70.8\nr30: A30=\"Unemployed\"; B30=209; C30=547; D30=516; E30=303; F30=214; G30=657; H30=429; I30=228\nr31: A31=\"Unemployment rate\"; B31=6.4; C31=3.8; D31=3; E31=3.3; F31=2.6; G31=2; H31=2.2; I31=1.8\nr32: A32=\"White\"\nr33: A33=\"Civilian noninstitutional population\"; B33=14776; C33=48957; D33=44376; E33=25347; F33=19029; G33=67744; H33=42178; I33=25567\nr34: A34=\"Civilian labor force\"; B34=7266; C34=27358; D34=27375; E34=15066; F34=12309; G34=48602; H34=30361; I34=18241\nr35: A35=\"Participation rate\"; B35=49.2; C35=55.9; D35=61.7; E35=59.4; F35=64.7; G35=71.7; H35=72; I35=71.3\nr36: A36=\"Employed\"; B36=6896; C36=26430; D36=26638; E36=14630; F36=12008; G36=47661; H36=29727; I36=17933\nr37: A37=\"Employment-population ratio\"; B37=46.7; C37=54; D37=60; E37=57.7; F37=63.1; G37=70.4; H37=70.5; I37=70.1\nr38: A38=\"Unemployed\"; B38=369; C38=928; D38=737; E38=436; F38=301; G38=941; H38=633; I38=308\nr39: A39=\"Unemployment rate\"; B39=5.1; C39=3.4; D39=2.7; E39=2.9; F39=2.4; G39=1.9; H39=2.1; I39=1.7\nr40: A40=\"Black or African American\"\nr41: A41=\"Civilian noninstitutional population\"; B41=2616; C41=9460; D41=8213; E41=5041; F41=3172; G41=8607; H41=5385; I41=3222\nr42: A42=\"Civilian labor force\"; B42=1032; C42=5610; D42=5535; E42=3243; F42=2291; G42=6733; H42=4179; I42=2553\nr43: A43=\"Participation rate\"; B43=39.5; C43=59.3; D43=67.4; E43=64.3; F43=72.2; G43=78.2; H43=77.6; I43=79.2\nr44: A44=\"Employed\"; B44=936; C44=5269; D44=5287; E44=3085; F44=2202; G44=6568; H44=4064; I44=2504\nr45: A45=\"Employment-population ratio\"; B45=35.8; C45=55.7; D45=64.4; E45=61.2; F45=69.4; G45=76.3; H45=75.5; I45=77.7\nr46: A46=\"Unemployed\"; B46=96; C46=341; D46=248; E46=159; F46=89; G46=164; H46=115; I46=49\nr47: A47=\"Unemployment rate\"; B47=9.3; C47=6.1; D47=4.5; E47=4.9; F47=3.9; G47=2.4; H47=2.8; I47=1.9\nr48: A48=\"Asian\"\nr49: A49=\"Civilian noninstitutional population\"; B49=1157; C49=2685; D49=2088; E49=1119; F49=969; G49=9272; H49=5132; I49=4139\nr50: A50=\"Civilian labor force\"; B50=452; C50=1510; D50=1380; E50=717; F50=663; G50=7052; H50=3721; I50=3330\nr51: A51=\"Participation rate\"; B51=39.1; C51=56.2; D51=66.1; E51=64.1; F51=68.4; G51=76.1; H51=72.5; I51=80.5\nr52: A52=\"Employed\"; B52=436; C52=1464; D52=1339; E52=698; F52=641; G52=6877; H52=3636; I52=3241\nr53: A53=\"Employment-population ratio\"; B53=37.7; C53=54.5; D53=64.1; E53=62.3; F53=66.2; G53=74.2; H53=70.8; I53=78.3\nr54: A54=\"Unemployed\"; B54=16; C54=46; D54=41; E54=20; F54=22; G54=175; H54=86; I54=89\nr55: A55=\"Unemployment rate\"; B55=3.6; C55=3; D55=3; E55=2.8; F55=3.3; G55=2.5; H55=2.3; I55=2.7\nr56: A56=\"Hispanic or Latino ethnicity\"\nr57: A57=\"Civilian noninstitutional population\"; B57=9207; C57=12315; D57=8087; E57=4825; F57=3262; G57=8228; H57=5689; I57=2540\nr58: A58=\"Civilian labor force\"; B58=5363; C58=8513; D58=5969; E58=3510; F58=2459; G58=6582; H58=4540; I58=2042\nr59: A59=\"Participation rate\"; B59=58.3; C59=69.1; D59=73.8; E59=72.8; F59=75.4; G59=80; H59=79.8; I59=80.4\nr60: A60=\"Employed\"; B60=5098; C60=8152; D60=5764; E60=3385; F60=2380; G60=6419; H60=4414; I60=2005\nr61: A61=\"Employment-population ratio\"; B61=55.4; C61=66.2; D61=71.3; E61=70.2; F61=72.9; G61=78; H61=77.6; I61=78.9\nr62: A62=\"Unemployed\"; B62=265; C62=361; D62=205; E62=125; F62=79; G62=163; H62=126; I62=37\nr63: A63=\"Unemployment rate\"; B63=4.9; C63=4.2; D63=3.4; E63=3.6; F63=3.2; G63=2.5; H63=2.8; I63=1.8\nr64: A64=\"\"\nr65: A65=\"Footnotes:\"\nr66: A66=\"(1) Includes persons with a high school diploma or equivalent.\"\nr67: A67=\"(2) Includes persons with bachelor`s, master`s, professional, and doctoral degrees.\"\nr68: A68=\"NOTE: Estimates for the above race groups (White, Black or African American, and Asian) do not sum to totals because data are not presented for all races. Persons whose ethnicity is identified as Hispanic or Latino may be of any race. Updated population controls are introduced annually with the release of January data.\"\nSEMANTIC_FACTS: [{\"sheet\": \"cpsaat07\", \"cell\": \"E25\", \"row_index\": 25, \"column_index\": 5, \"value_raw\": 16796, \"value_type\": \"number\", \"display_value\": \"16796\", \"unit\": \"thousand persons\", \"formula\": null, \"section_path\": [\"Women\"], \"row_header_path\": [\"Civilian noninstitutional population\"], \"column_header_path\": [\"Some college or associate degree\", \"Some college, no degree\"]}, {\"sheet\": \"cpsaat07\", \"cell\": \"E26\", \"row_index\": 26, \"column_index\": 5, \"value_raw\": 9128, \"value_type\": \"number\", \"display_value\": \"9128\", \"unit\": \"thousand persons\", \"formula\": null, \"section_path\": [\"Women\"], \"row_header_path\": [\"Civilian labor force\"], \"column_header_path\": [\"Some college or associate degree\", \"Some college, no degree\"]}]",
  "answer_spec": {
    "kind": "integer",
    "decimals": null,
    "separator": null,
    "allowed_values": null,
    "item_count": null,
    "rounding": "ROUND_HALF_UP"
  },
  "context_meta": {
    "sheets_included": [
      "cpsaat07"
    ],
    "included_ranges": {
      "cpsaat07": [
        "A1:I68"
      ]
    },
    "table_view_hash": "1a7988d8c1d86a432087b18865f797a517c4e59f2f01a5ab4f41afa1d660ecfc",
    "coverage": "full",
    "truncated": false
  }
}
